{
  "$schema": "http://json-schema.org/draft-07/schema#",
  "title": "getff reference family I (plugin)",
  "type": "object",
  "additionalProperties": false,
  "required": [
    "schemaVersion",
    "family",
    "familyName",
    "generator",
    "members"
  ],
  "properties": {
    "schemaVersion": {
      "const": 1
    },
    "family": {
      "const": "I"
    },
    "familyName": {
      "type": "string",
      "minLength": 1
    },
    "generator": {
      "const": "scripts/render-reference.mjs"
    },
    "members": {
      "type": "array",
      "items": {
        "type": "object",
        "additionalProperties": false,
        "required": [
          "name",
          "kind",
          "shipsTo",
          "description",
          "source",
          "extras",
          "example"
        ],
        "properties": {
          "name": {
            "type": "string",
            "minLength": 1
          },
          "kind": {
            "const": "plugin-component"
          },
          "shipsTo": {
            "type": "object",
            "additionalProperties": false,
            "required": [
              "tier"
            ],
            "properties": {
              "tier": {
                "const": "plugin"
              }
            }
          },
          "description": {
            "type": "string",
            "minLength": 1
          },
          "source": {
            "type": "object",
            "additionalProperties": false,
            "required": [
              "path",
              "line"
            ],
            "properties": {
              "path": {
                "type": "string",
                "minLength": 1
              },
              "line": {
                "type": "integer",
                "minimum": 1
              }
            }
          },
          "extras": {
            "type": "object",
            "additionalProperties": false,
            "required": [
              "component",
              "twin-of"
            ],
            "properties": {
              "component": {
                "enum": [
                  "skill",
                  "command",
                  "agent"
                ]
              },
              "twin-of": {
                "anyOf": [
                  {
                    "type": "string",
                    "minLength": 1
                  },
                  {
                    "type": "object",
                    "additionalProperties": false,
                    "required": [
                      "absent"
                    ],
                    "properties": {
                      "absent": {
                        "enum": [
                          "no-lane",
                          "no-operator-twin",
                          "not-byte-copied"
                        ]
                      }
                    }
                  }
                ]
              }
            }
          },
          "example": {
            "type": [
              "string",
              "null"
            ],
            "minLength": 1
          }
        }
      }
    }
  }
}
