{
  "schemaVersion": 1,
  "family": "I",
  "familyName": "plugin",
  "generator": "scripts/render-reference.mjs",
  "members": [
    {
      "name": "ai-doc",
      "kind": "plugin-component",
      "shipsTo": {
        "tier": "plugin"
      },
      "description": "Use when creating or fixing an AI-facing doc/rule/skill/agent in this repo (SKILL.md, .claude/rules/*, agents/*, CLAUDE.md, AGENTS.md) — to apply the project's context-hygiene + rule-as-test + AI-agnostic authoring standard. Triggers: write a rule, author a skill, fix a doc, doc-authority header, progressive disclosure, channel selection, документация, правило, скилл.",
      "source": {
        "path": "plugin/skills/ai-doc/SKILL.md",
        "line": 3
      },
      "extras": {
        "component": "skill",
        "twin-of": {
          "absent": "not-byte-copied"
        }
      },
      "example": null
    },
    {
      "name": "compliance-verifier",
      "kind": "plugin-component",
      "shipsTo": {
        "tier": "plugin"
      },
      "description": "Reviews PR description §1.7 Forward-check and Backward-check sections for substantive evidence — file:line citations, sweep completeness, exemption quality. Reports; does not fix.",
      "source": {
        "path": "plugin/agents/compliance-verifier.md",
        "line": 3
      },
      "extras": {
        "component": "agent",
        "twin-of": ".agents/roles/compliance-verifier.md"
      },
      "example": null
    },
    {
      "name": "docs-form-auditor",
      "kind": "plugin-component",
      "shipsTo": {
        "tier": "plugin"
      },
      "description": "Cold form audit of getff.ai docs pages against the reader-comfort card (C1-C13). Given ONLY page paths, their kinds, and the card path (never the writer's dialogue), enumerates the page population, runs scripts/docs-check.mjs for the deterministic numbers, fills the card per page with file:line evidence, diffs its verdict against the Docs-card trailer in each commit, and reports SYSTEMIC-vs-LOCAL patterns plus a GO/REVISE/STOP verdict. Reporting-only; never invoked from CI; never judges facts. Triggers: gold-page review, family checkpoint, final site check, docs refresh touching >=5 pages.",
      "source": {
        "path": "plugin/agents/docs-form-auditor.md",
        "line": 3
      },
      "extras": {
        "component": "agent",
        "twin-of": ".agents/roles/docs-form-auditor.md"
      },
      "example": null
    },
    {
      "name": "getff",
      "kind": "plugin-component",
      "shipsTo": {
        "tier": "plugin"
      },
      "description": "Use when treating any codebase rule (architectural, naming, dependency, test-quality, contract, SLO) as an executable test that fails the build when violated, or when the user asks about enforcing code quality, fighting AI-generated code drift, setting up linters/tests/CI/pre-commit hooks, designing review processes, mutation testing, contract testing, fitness functions, observability-driven development, SLO-as-code, or \"how do I make my codebase resistant to AI agents breaking my conventions\". Also trigger on ArchUnit, Stryker, Pact, dependency-cruiser, AI Factory (aif), Husky, lint-staged, ESLint flat config, Zod validation strategy, or shift-left/shift-right testing. Strongly trigger when the user mentions Claude Code, Cursor, or Copilot writing code that \"looks fine but is wrong\".",
      "source": {
        "path": "plugin/skills/getff/SKILL.md",
        "line": 3
      },
      "extras": {
        "component": "skill",
        "twin-of": {
          "absent": "not-byte-copied"
        }
      },
      "example": null
    },
    {
      "name": "install-enforcement",
      "kind": "plugin-component",
      "shipsTo": {
        "tier": "plugin"
      },
      "description": "Opt-in — wire the HARD enforcement layer (git hooks + CI) into THIS repo by fetching and running the project's official installer. Dry-run first, consent-gated. The plugin's soft layer (skills/agents/session hooks) is already live; this is the separate bridge to the part a plugin can never silently install.",
      "source": {
        "path": "plugin/commands/install-enforcement.md",
        "line": 2
      },
      "extras": {
        "component": "command",
        "twin-of": {
          "absent": "not-byte-copied"
        }
      },
      "example": null
    },
    {
      "name": "installing-enforcement",
      "kind": "plugin-component",
      "shipsTo": {
        "tier": "plugin"
      },
      "description": "Use when the user wants to actually WIRE the hard enforcement layer (git pre-commit/pre-push hooks + CI) into their repo, or asks \"how do I make these rules actually fail the build / block a commit / run in CI\", or wants to turn the rules-as-tests methodology from advice into a build-failing gate. Explains the soft-vs-hard boundary and points at the /getff:install-enforcement command.",
      "source": {
        "path": "plugin/skills/installing-enforcement/SKILL.md",
        "line": 3
      },
      "extras": {
        "component": "skill",
        "twin-of": ".agents/procedures/installing-enforcement/SKILL.md"
      },
      "example": null
    },
    {
      "name": "living-docs-auditor",
      "kind": "plugin-component",
      "shipsTo": {
        "tier": "plugin"
      },
      "description": ">-",
      "source": {
        "path": "plugin/agents/living-docs-auditor.md",
        "line": 3
      },
      "extras": {
        "component": "agent",
        "twin-of": ".agents/roles/living-docs-auditor.md"
      },
      "example": null
    },
    {
      "name": "review-sidecar",
      "kind": "plugin-component",
      "shipsTo": {
        "tier": "plugin"
      },
      "description": "Reviews diff as an external reviewer with no memory of how the code was written. Catches tautological tests, mock-only assertions, missing edge cases, React/Next anti-patterns. Reports; does not fix. Uses read-only Bash for diff inspection (git diff/log/show, ls) — no mutations, no worktrees, no pushes (GH #1516).",
      "source": {
        "path": "plugin/agents/review-sidecar.md",
        "line": 3
      },
      "extras": {
        "component": "agent",
        "twin-of": ".agents/roles/review-sidecar.md"
      },
      "example": null
    },
    {
      "name": "rule-research",
      "kind": "plugin-component",
      "shipsTo": {
        "tier": "plugin"
      },
      "description": "Use when a consumer wants to bootstrap stack-aware ESLint rules from LIVE documentation rather than ship pre-baked recipes. Triggers: rule research, research stack practices, generate eslint rule from docs, bootstrap rules for my stack, rules-research, rule-bootstrapping, no-head-element, исследовать практики стека, сгенерировать правило из документации.",
      "source": {
        "path": "plugin/skills/rule-research/SKILL.md",
        "line": 3
      },
      "extras": {
        "component": "skill",
        "twin-of": {
          "absent": "not-byte-copied"
        }
      },
      "example": null
    },
    {
      "name": "rule-tests",
      "kind": "plugin-component",
      "shipsTo": {
        "tier": "plugin"
      },
      "description": "Use when a consumer has an EXISTING generated rule whose firing test material is missing, broken, or needs a bypass variant. Triggers: rule tests, repair test material, fix negative-test, rule test material, verify the rule fires, rule-tests, починить тест правила, исправить негативный тест, проверить что правило срабатывает, тестовый материал для правила. NOT for creating new rules (/rule-research).",
      "source": {
        "path": "plugin/skills/rule-tests/SKILL.md",
        "line": 3
      },
      "extras": {
        "component": "skill",
        "twin-of": {
          "absent": "not-byte-copied"
        }
      },
      "example": null
    },
    {
      "name": "template-audit",
      "kind": "plugin-component",
      "shipsTo": {
        "tier": "plugin"
      },
      "description": "Use when auditing rendered templates via local advisory review. Triggers: template, audit, render, generated docs, AGENTS.md, paraphrase, cue placement, local advisory, template-render, audit-template.",
      "source": {
        "path": "plugin/skills/template-audit/SKILL.md",
        "line": 3
      },
      "extras": {
        "component": "skill",
        "twin-of": {
          "absent": "not-byte-copied"
        }
      },
      "example": null
    },
    {
      "name": "tool-bootstrapping",
      "kind": "plugin-component",
      "shipsTo": {
        "tier": "plugin"
      },
      "description": "Use when analysing project stack for MCP or skill recommendations. Triggers: tool bootstrapping, MCP installation, skill discovery, project onboarding tools, package.json deps changed, .ai-factory/tool-decisions.md, AIF /aif, tool detection, инструменты, бутстраппинг, MCP серверы, скиллы, зависимости, онбординг, подбор инструментов, предложение инструментов, подтверждение установки, tool proposal confirmation, incremental tool re-evaluation, rejected tools memory, memory persistence for tools.",
      "source": {
        "path": "plugin/skills/tool-bootstrapping/SKILL.md",
        "line": 3
      },
      "extras": {
        "component": "skill",
        "twin-of": {
          "absent": "not-byte-copied"
        }
      },
      "example": null
    },
    {
      "name": "using-getff",
      "kind": "plugin-component",
      "shipsTo": {
        "tier": "plugin"
      },